{
  "schemaVersion": "arcsweep.ingest-primer/v0.1",
  "primerId": "star-trek-sundancer-canon-ingest",
  "name": "Star Trek: Sundancer Canon Ingest",
  "scope": {
    "appliesToAllCanons": false,
    "worldIds": ["star-trek-sundancer"],
    "overlayOf": null
  },
  "sourcePolicy": {
    "acceptedExtensions": [".txt", ".md", ".json", ".pdf", ".docx", ".png", ".jpg", ".jpeg", ".webp"],
    "copyIntoPrivateStore": true,
    "hashAlgorithm": "sha256",
    "preserveOriginalName": true,
    "preserveRelativePath": true,
    "automaticExternalReads": false,
    "deduplicateByHash": true,
    "maximumFileBytes": null
  },
  "canonPolicy": {
    "authorityLevels": ["primary-canon", "working-canon", "author-note", "adaptation", "reference", "inspiration", "deprecated", "unknown"],
    "statusValues": ["canonical", "working", "candidate", "contradicted", "retired", "reference-only", "unclassified"],
    "neverOverwriteWithoutApproval": true,
    "rawSourceIsImmutable": true,
    "canonMayContainMultipleTimelines": true,
    "variantsRemainNamed": true
  },
  "classification": {
    "canonKinds": [
      "world",
      "character",
      "relationship",
      "location",
      "timeline",
      "scene-or-event",
      "culture-or-society",
      "science-or-technology",
      "language-glyph-or-pronunciation",
      "wardrobe-or-appearance",
      "visual-reference",
      "production-note",
      "alternate-universe-or-variant",
      "meta-continuity"
    ],
    "entityKinds": [
      "world",
      "timeline",
      "character",
      "group",
      "relationship-edge",
      "place",
      "event",
      "object",
      "term",
      "ability",
      "rule",
      "source-note"
    ],
    "worldResolution": "explicit-first",
    "timelineResolution": "preserve-all",
    "relationshipResolution": "both"
  },
  "extraction": {
    "proposalOnly": true,
    "requiredProvenance": ["sourceId", "sourceHash", "sourceName", "relativePath", "heading", "lineRange", "extractedAt", "extractor"],
    "extractors": [
      "document-metadata",
      "headings-and-sections",
      "named-entities",
      "dates-and-timelines",
      "relationships",
      "rules-and-constraints",
      "glossary-and-pronunciation",
      "assets-and-attachments",
      "canon-status-language",
      "contradiction-candidates"
    ],
    "plainTextFallback": true,
    "ocrAllowed": false,
    "crossSourceSynthesis": "proposal-only"
  },
  "conflictPolicy": {
    "detect": true,
    "quarantine": true,
    "resolutionModes": ["keep-both-as-variants", "promote-one", "merge-with-notes", "mark-unresolved", "retire-older"],
    "automaticWinnerSelection": false
  },
  "approvalPolicy": {
    "approvalRequiredBeforeCanonWrite": true,
    "batchApprovalAllowed": true,
    "reversible": true,
    "receiptRequired": true
  },
  "exportPolicy": {
    "formats": ["json", "arcsweep-canon-json", "portable-canon-folder", "markdown"],
    "includeSourceReceipts": true,
    "includePrimer": true,
    "sourceInclusionModes": ["none", "selected", "all"],
    "redactionBeforeExport": true
  }
}
